Movie_ID,Title,Director,Cast,Year,Genre
2013,Bhalobasar Bandhan,M B Reza,"Aman, Anna, Shajid, Tithi",2013,Romance
2014,Television,Mostofa Sarwar Farooki,"Shahir Huda Rumi, Chanchal Chowdhury, Mosharraf Karim, Nusrat Imrose Tisha",2013,Drama
2015,Jor Kore Bhalobasha Hoyna,Shahadat Hossain Liton,"Shakib Khan, Sahara, Mukti, Misha Sawdagor",2013,Romance
2016,Devdas,Chashi Nazrul Islam,"Shakib Khan, Apu Biswas, Moushumi, Shahiduzzaman Selim, Ahmed Sharif",2013,"Drama, Romance"
2017,Onnorokom Bhalobasha,Shahin Sumon,"Bappy Chowdhury, Mahiya Mahi, Amit Hasan, Sara Jerin",2013,Romance
2018,Antordhan,Syed Wahiduzzaman Diamond,"Ferdous Ahmed, Nipun Akter",2013,Drama
2019,Jibon Nodir Tire,Monir Hossain Mithu,"Nirab Hossain, Anan",2013,Romance
2020,Pagol Tor Jonno Re,Mayeen Biswas,"Irfan Khan, Tamanna, Omar Sani",2013,Romance
2021,Simanaheen,"Kevin Dalvi, Ria Mahtab","Rahsaan Islam, Ismat Alamgir",2013,Romance
2022,Attoghatok,Palash Parvez,"Shoyeb Khan, Rafid Khan, Keya",2013,Action
2023,Shiri Forhad,Gazi Mahbub,"Riaz, Shabnur",2013,"Romance, Drama"
2024,Hridoye 71,Sadeq Siddiqui,"Mamnun Hasan Emon, Romana, Shahidul Islam Shacchu",2013,Drama
2025,Kosto Amar Duniya,Satya Ranjan Romance,"Ratna, Siraj Haidar, Apon Chowdhury, Kazi Hayat",2013,"Action, Romance"
2026,Sei Tumi Anamika,Sarwar Hossain,"Shoyeb Khan, Rashed Khan, Shahrin, Mehrun",2013,Romance
2027,Dehorokkhi: The Bodyguard,Iftakar Chowdhury,"Anisur Rahman Milon, Bobby, Kazi Maruf",2013,Action
2028,Shikhandi Kotha,Mohammad Hannan,"Mohammad Hannan,  Rokeya Prachi, Jayanta Chattapaddhay",2013,Drama
2029,Matir Pinjira,S M Shahnewaz Shanu,"Shahed Chowdhury, Raisul Islam Asad, Shampa, Pijush Bandhapaddhay,",2013,"Drama, Romance"
2030,Judge Barrister Police Commissioner,F.I Manik,"Shakib Khan, Purnima, Razzak",2013,"Action, Drama, Romance"
2031,Jotil Prem,Shaheen Sumon,"Bappy Chowdhury, Achol, Ilias Kanchan, Champa, Misha Sawdagor",2013,Romance
2032,Eito Bhalobasha,Shahin Kabir Tutul,"Mamnun Hasan Emon, Nirob, Nipun Akter, Siddiqur Rahman",2013,"Comedy, Romance"
2033,Nishpap Munna,Badiul Alam Khokon,"Shakib Khan, Sahara, Misha Sawdagor, Bapparaz",2013,"Action, Romance"
2034,Romeo 2013,Raju Chowdhury,"Bappy Chowdhury, Sara Jerin",2013,Romance
2035,PoraMon,Jakir Hossain Raju,"Symon Sadik, Mahiya Mahi, Ali Raz, Anisur Rahman Milon, Misha Sawdagor",2013,Romance
2036,Prem Prem Paglaami,Shafi Uddin Shafi,"Bappy Chowdhury, Achol, Amit Hasan, Kazi Hayat",2013,Romance
2037,Tomar Majhe Ami,Shafiqul Islam Sohel,"Nirab, Toma Mirza, Sadeq Bacchu",2013,Romance
2038,Kajoler Din Ratri,Sajal Khaled,"Tarin, Iresh Zaker",2013,Drama
2039,Nishwartha Bhalobasa,Ananta Jalil,"Ananta Jalil, Afiea Nusrat Barsha, Razzak, Misha Sawdagor",2013,"Romance, Action"
2040,My Name Is Khan,Badiul Alam Khokon,"Shakib Khan, Apu Biswas, Prabir Mitra, Misha Sawdagor",2013,"Action, Romance"
2041,Bhalobasha Aaj Kal,P.A Kajal,"Shakib Khan, Mahiya Mahi, Misha Sawdagor, Kabila, Ali Raz",2013,"Romance, Comedy"
2042,Ek Paye Nupur,Babul Reza,"Aman, Anna, Amir Siraji, Gulshan Ara",2013,Romance
2043,Er Beshi Bhalobasha Jay Na,Jakir Hossain Raju,"Symon Sadik, Nijhum, Sohel Khan",2013,Romance
2044,Kumari Maa,Shahdat Hossain Liton,"Nirab Hossain, Tuli, Asif Iqbal, Munmun",2013,"Romance, Drama"
2045,Notun Shat Bhai Champa,Mizanur Rahman,"Sheikh Mizan, Karishma",2013,Drama
2046,Eve Teasing,Kazi Hayat,"Kazi Maruf, Toma Mirza, Kazi Hayat",2013,"Action, Drama"
2047,Mrittika Maya,Gazi Rakayet,"Raisul Islam Asad, Pijush Bandhapaddhay, Mamunur Rashid,",2013,Drama
2048,Dhaka to Bombay,Uttam Akash,"Shakib Khan, Sahara, Omar Sani, Suchorita",2013,"Action, Drama"
2049,Rupgawal,Habibur Rahman Habib,"Masum Aziz, Niloy Alamgir, Shimla, Champa",2013,"Drama, Romance"
2050,Mon Tor Jonno Pagol,Hanif Reza Milon,"Kayes Arju, Sanjana, Habib Khan",2013,Romance
2051,Kisu Asha Kisu Bhalobasha,Mostafizur Rahman Manik,"Ferdous Ahmed, Moushumi, Shabnur, Happy",2013,Romance
2052,Banglar Paglu,Kishor Saha,"Abhi, Priyanka, Kabila, Aritra",2013,"Action, Romance"
2053,Tobuo Bhalobashi,Montazur Rahman Akbar,"Bappy Chowdhury, Mahiya Mahi, Sohel Rana, Amit Hasan, Parveen Sultana Diti",2013,Romance
2054,Udhao - Runaway,Amit Ashraf,"Monir Ahmed,Nawshaba Ahmed, Shahed Ali, Animesh Aich",2013,"Crime, Drama"
2055,Purno Doirgho Prem Kahini,Shafi Uddin Shafi,"Shakib Khan, Joya Ahsan, Arifin Shuvoo",2013,Romance
2056,Full and Final,Malek Afsari,"Shakib Khan, Bobby, Amit Hasan",2013,Action
2057,Premik Number One,Rokibul Islam Rokib,"Shakib Khan, Apu Biswas, Nipun Akter, Dilip Chakrabarty, Bobita, Milon",2013,Romance
2058,Ki Prem Dekhaila,Shah Muhammad Songhram,"Bappy Chowdhury, Achol, Ali Raz, Bobita",2013,Romance
2059,Anishchit Jatra,Belal Ahmed,"Abul Kalam Azad, Momena Chowdhury, Dilip Chakrabarty, Anisur Rahman Milon",2013,Drama
2060,Akoi Britte,Kazi Morshed,"Najnin Chumki, Tauquir Ahmed, Khalil, Raisul Islam Asad, Dolly Jahur",2013,Drama
2061,Ayna Kahini,Razzak,"Somrat, Keya, Sohel Khan, Razzak",2013,"Romance, Drama"
2062,Valobasha Zindabad,Debashish Biswas,"Arifin Shuvoo, Airin Sultana, Sadek Bacchu",2013,Romance
2063,Inchi Inchi Prem,Raju Chowdhury,"Bappy Chowdhury, Bobby, Sohel Khan",2013,"Action, Drama"
2064,Tomar Achi Tomari Thakbo,Kalam Kaisar,"Shrabon Khan, Nirjana, Moumita, Prabir Mitra, Khaleda Akter Kolpona",2013,Romance
2065,Padma Parer Parboti,Rafiq Sikder,"Nipun Akter, Mamnun Hasan Emon, Nirab Hossain, Jayanta Chattopadhyay",2013,Romance
2066,71 er Guerrilla,Mizanur Rahman Shamim,"Sohel Rana, Khaleda Akter Kolpona, Alexandar Bo",2013,Drama
