Movie_ID,Title,Director,Cast,Year,Genre
83768151,Antore Acho Tumi,P A Kajal,"Romance, Musical",2011,"Romance, Musical"
83768152,Darwaner Chele,Rokibul Alam Rokib,"Kazi Maruf, Sahara, Mukti",2011,Romance
83768153,Gariber Mon Onek Boro,Mohammad Aslam,"Amin Khan, Purnima, Nipun Akter",2011,"Action, Drama"
83768154,Matir Thikana,Shah Alam Kiran,"Shakib Khan, Purnima, Shakiba",2011,"Drama, Romance"
83768155,Bondhu Tumi Shatru Tumi,Royal Babu,"Kazi Maruf, Amit Hasan, Nirab Hossain, Sahara, Keya",2011,Action
83768156,Koti Takar Prem,Sohanur Rahman Sohan,"Shakib Khan, Apu Biswas",2011,Romance
83768157,Tor Karone Beche Achi,M B Manik,"Shakib Khan, Apu Biswas",2011,Drama
83768158,Jaan Kurbaan,M B Manik,"Shakib Khan, Apu Biswas",2011,"Action, Romance"
83768159,Gariber Bhai,P A Kajal,"Mamnun Hasan Emon, Dipjol, Resi, Romana, Zayed Khan, Shakiba",2011,Drama
83768160,Kusum Kusum Prem,Mushfiqur Rahman Guljar,"Riaz, Ferdous Ahmed, Moushumi",2011,Romance
83768161,Tiger Number One,Shahin Sumon,"Shakib Khan, Amit Hasan, Sahara,Nipun Akter",2011,"Action, Romance"
83768162,Ekbar Bolo Bhalobashi,Badiul Alam Khokon,"Shakib Khan, Apu Biswas, Toma Mirza",2011,"Action, Romance"
83768163,Amar Prithibi Tumi,Gazi Mahbub,"Mamnun Hasan Emon, Dipjol,Sahara, Zayed Khan, Resi",2011,Romance
83768164,Dui Purush,Chashi Nazrul Islam,"Riaz, Moushumi, Nipun Akter",2011,Drama
83768165,Bhool,Raju Ahmed,Drama,2011,Drama
83768166,Angko,Shahin Sumon,Drama,2011,Drama
83768167,Champa Ranir Akhra,Swapan Chowdury,Action,2011,Action
83768168,Bailey Road,Masud Kainat,"Niloy Alamgir, Achol",2011,Romance
83768169,Ek Takar Chele Koti Takar Meye,Kamol Sarker,"Kazi Maruf, Shomrat, Sahara, Ratna",2011,Action
83768170,Garments Konna,G Sarker,"Mamnun Hasan Emon, Popy",2011,"Action, Romance"
83768171,Moner Ghore Boshot Kore,Jakir Hossain Raju,Romance,2011,Romance
83768172,Boss Number One,Mohammad Hossain,"Shakib Khan, Sahara, Nipun Akter",2011,Romance
83768173,Chotto Songshar,Montazur Rahman Akbar,"Kazi Maruf, Dipjol, Resi, Toma Mirza",2011,Romance
83768174,Bondhu Tumi Amar,Nazrul Islam,"Riaz, Purnima,",2011,Romance
83768175,Priya Amar Jaan,Raju Chowdhury,"Shakib Khan, Apu Biswas,",2011,Romance
83768176,King Khan,Mohammad Hossain Jemmy,"Shakib Khan, Apu Biswas, Mimo",2011,"Action, Romance"
83768177,Projapoti,Mohammad Mostafa Kamal Raz,"Moushumi, Zahid Hasan, Mosharraf Karim, Sohel Khan, Kochi Khondokar ",2011,"Drama, Thriller"
83768178,Nishiddho Rashta,Shopon Chowdhury,"Alexandar Bo, Shaila",2011,Action
83768179,Ke Apon Ke Por,Shahin Shumon,"Apu Biswas, Amit Hasan ",2011,"Action, Romance"
83768180,Pita Putrer Golpo,Kazi Hayat,Drama,2011,Drama
83768181,Sathi Hara Nagin,Delowar Jahan Jhantu,"Action, Romantic",2011,"Action, Romantic"
83768182,Hridoy Bhanga Dheu,Gazi Mazharul Anwar,"Ananta Jalil, Barsha",2011,"Action, Romance"
83768183,Ma er Gaaye Biyer Sharee,A K Sohel,"Jidan, Shimla, Dighi, Ahmed Sharif ",2011,Drama
83768184,Adorer Jamai,Shahadat Hossain Liton,"Shakib Khan, Apu Biswas, Nipun Akter",2011,"Action, Comedy"
83768145,Firey Esho Behula,Tanim Noor,"Joya Ahsan, Intekhab Dinar, Humayun Faridi, Mamunur Rashid, Jayanta Chattapaddhay, Raisul Islam Asad, Shahiduzzaman Selim, Tauquir Ahmed, Shatabdi Wadud",2012,Drama
83768146,Maruf er Challenge,Shahadat Hossain Liton,"Sahara, Mamnun Hasan Emon, Nipun Akter, Kazi Maruf",2012,Action
83768147,Rokte Bheja Bangladesh,Nadim Mahmud,"Shadhin, Ratna, Prabir Mitra, Misha Sawdagor",2012,Drama
83768148,I Love You,Mushfiqur Rahman Guljar,"Shakib Khan, Purnima, Resi, Nirab, Ilias Kanchan",2012,Romance
83768149,Jibone Tumi Morone Tumi,Apurba Rana,"Jeff, Shreya, Sohel Rana",2012,Romance
83768150,Lal Tip,Swapan Ahmed,"Mamnun Hasan Emon, Kusum Sikder, Benjamin Dupich, ATM Shamsuzzaman, Ana Levis, Sohel Khan",2012,"Romance, Drama"
83768151,Ek Jonomer Koster Prem,Nadim Mahmud,"Saif Khan, Nodi, Swapna, Shoyeb Khan",2012,"Action, Romance"
83768152,Amar Challenge,Badiul Alam Khokon,"Shakib Khan, Sahara, Misha Sawdagor",2012,"Action, Romance"
83768153,Raja Surjo Kha,Gazi Mahbub,"Kazi Maruf, Purnima, Sohel Rana, Bobita, Kabori, Nirab",2012,Drama
83768154,Palabar Path Nei,Apurba Rana,"Saif Khan, Toma Mirza, Aman, Kazi Hayat",2012,Action
83768155,Bangladeshi,Monowar Khokon,"Jahangir Jhinuk, Enamul Mozammel, Ahmed Sharif",2012,Action
83768156,Ek Takar Denmohor,M B Manik,"Shakib Khan, Apu Biswas, Sohel Rana, Suchorita",2012,Romance
83768157,Karigor,Anwar Shahadat,"Jayanta Chattapaddhay, Rokeya Prachi, Rani Sarkar, Masud Alam Babu",2012,Drama
83768158,Manik Ratan Dui Bhai,Kazi Hayat,"Kazi Maruf, Dipjol, Resi, Toma Mirza",2012,"Comedy, Romance"
83768159,Ji Hujur,Zakir Hossain Raju,"Symon Sadik, Sara Zerin, Anan",2012,"Comedy, Romance"
83768160,Ek Mon Ek Pran,Sohanur Rahman Sohan,"Shakib Khan, Toma Mirza, Apu Biswas",2012,Romance
83768161,Antore Premer Jala,Kalam Kaisar,"Sajid Khan, Shehnai",2012,Romance
83768162,Bazarer Kuli,Montazur Rahman Akbar,"Resi, Nipun Akter, Aman, Anna,Misha Sawdagor, Dipjol",2012,Action
83768163,Charulata,Saiful Islam Mannu,"Ilias Kanchan, Kumkum Hasan, Shajal, Mita Noor",2012,
83768164,The Speed,Sohanur Rahman Sohan,"Ananta Jalil, Parveen, Nana, Dighi, Parveen Sultana Diti, Alamgir, Nino",2012,"Action, Romance"
83768165,Uttarer Sur,Shahnewaz Kakoli,"Utpal, Lucy, Meghla",2012,Drama
83768166,Attogopon,M M Sarkar,"Zayed Khan, Shabnur",2012,Romance
83768167,Common Gender,Noman Rabin,"Sohel Khan, Hasan Masood, Reza Siddqui, Rashed Mamun, Rosy Siddiqui",2012,Drama
83768168,Most Welcome,Anonno Mamun,"Ananta Jalil, Barsha, Sneha Ullal, Razzak, Bapparaj",2012,"Action, Romance"
83768169,My Name Is Sultan,F I Manik,"Shakib Khan, Sahara, Prabir Mitra, Rina Khan",2012,"Action, Romance"
83768170,Dhakar King,Shafi Uddin Shafi,"Shakib Khan, Nipun Akter, Apu Biswas",2012,Action
83768171,Se Amar Mon Kereche,Sohanur Rahman Sohan,"Shakib Khan, Tinni, Almgir, Misha Sawdagor",2012,Romance
83768172,Tumi Ashbe Bole,Ashraful Rahman,"Nirab Hossain, Nipun Akter",2012,Romance
83768173,Hothat Sedin,Basu Chatterjee,"Ferdous Ahmed, Ridhima Ghosh, Nipun",2012,Romance
83768174,Ghetuputra Kamola,Humayun Ahmed,"Mamun, Tariq Anam Khan, Agun, Jayanta Chattopadhyay, Munmun Ahmed",2012,Drama
83768175,Bhalobashar Rong,Shahin Sumon,"Mahiya Mahi, Bappy Chowdhury, Razzak, Amit Hasan",2012,Romance
83768176,Don Number One,Badiul Alam Khokon,"Shakib Khan, Sahara, Misha Sawdagor",2012,"Action, Romance"
83768177,Chorabali,Redoan Rony,"Joya Ahsan, Indraneil Sengupta, Sohel Rana, ATM Shamsuzzaman, Shahiduzzaman Selim",2012,"Crime, Thriller"
83768178,Pita - The Father,Masud Akhand,"Jayanta Chattapaddhay, Shaina Amin, Kallyan, Masud Akhand Maria Farih upama, moin duurrani, Armand Ara Bokul",2012,"War, Drama"
83768145,Bhalobasar Bandhan,M B Reza,"Aman, Anna, Shajid, Tithi",2013,Romance
83768146,Television,Mostofa Sarwar Farooki,"Shahir Huda Rumi, Chanchal Chowdhury, Mosharraf Karim, Nusrat Imrose Tisha",2013,Drama
83768147,Jor Kore Bhalobasha Hoyna,Shahadat Hossain Liton,"Shakib Khan, Sahara, Mukti, Misha Sawdagor",2013,Romance
83768148,Devdas,Chashi Nazrul Islam,"Shakib Khan, Apu Biswas, Moushumi, Shahiduzzaman Selim, Ahmed Sharif",2013,"Drama, Romance"
83768149,Onnorokom Bhalobasha,Shahin Sumon,"Bappy Chowdhury, Mahiya Mahi, Amit Hasan, Sara Jerin",2013,Romance
83768150,Antordhan,Syed Wahiduzzaman Diamond,"Ferdous Ahmed, Nipun Akter",2013,Drama
83768151,Jibon Nodir Tire,Monir Hossain Mithu,"Nirab Hossain, Anan",2013,Romance
83768152,Pagol Tor Jonno Re,Mayeen Biswas,"Irfan Khan, Tamanna, Omar Sani",2013,Romance
83768153,Simanaheen,"Kevin Dalvi, Ria Mahtab","Rahsaan Islam, Ismat Alamgir",2013,Romance
83768154,Attoghatok,Palash Parvez,"Shoyeb Khan, Rafid Khan, Keya",2013,Action
83768155,Shiri Forhad,Gazi Mahbub,"Riaz, Shabnur",2013,"Romance, Drama"
83768156,Hridoye 71,Sadeq Siddiqui,"Mamnun Hasan Emon, Romana, Shahidul Islam Shacchu",2013,Drama
83768157,Kosto Amar Duniya,Satya Ranjan Romance,"Ratna, Siraj Haidar, Apon Chowdhury, Kazi Hayat",2013,"Action, Romance"
83768158,Sei Tumi Anamika,Sarwar Hossain,"Shoyeb Khan, Rashed Khan, Shahrin, Mehrun",2013,Romance
83768159,Dehorokkhi: The Bodyguard,Iftakar Chowdhury,"Anisur Rahman Milon, Bobby, Kazi Maruf",2013,Action
83768160,Shikhandi Kotha,Mohammad Hannan,"Mohammad Hannan,  Rokeya Prachi, Jayanta Chattapaddhay",2013,Drama
83768161,Matir Pinjira,S M Shahnewaz Shanu,"Shahed Chowdhury, Raisul Islam Asad, Shampa, Pijush Bandhapaddhay,",2013,"Drama, Romance"
83768162,Judge Barrister Police Commissioner,F.I Manik,"Shakib Khan, Purnima, Razzak",2013,"Action, Drama, Romance"
83768163,Jotil Prem,Shaheen Sumon,"Bappy Chowdhury, Achol, Ilias Kanchan, Champa, Misha Sawdagor",2013,Romance
83768164,Eito Bhalobasha,Shahin Kabir Tutul,"Mamnun Hasan Emon, Nirob, Nipun Akter, Siddiqur Rahman",2013,"Comedy, Romance"
83768165,Nishpap Munna,Badiul Alam Khokon,"Shakib Khan, Sahara, Misha Sawdagor, Bapparaz",2013,"Action, Romance"
83768166,Romeo 2013,Raju Chowdhury,"Bappy Chowdhury, Sara Jerin",2013,Romance
83768167,PoraMon,Jakir Hossain Raju,"Symon Sadik, Mahiya Mahi, Ali Raz, Anisur Rahman Milon, Misha Sawdagor",2013,Romance
83768168,Prem Prem Paglaami,Shafi Uddin Shafi,"Bappy Chowdhury, Achol, Amit Hasan, Kazi Hayat",2013,Romance
83768169,Tomar Majhe Ami,Shafiqul Islam Sohel,"Nirab, Toma Mirza, Sadeq Bacchu",2013,Romance
83768170,Kajoler Din Ratri,Sajal Khaled,"Tarin, Iresh Zaker",2013,Drama
83768171,Nishwartha Bhalobasa,Ananta Jalil,"Ananta Jalil, Afiea Nusrat Barsha, Razzak, Misha Sawdagor",2013,"Romance, Action"
83768172,My Name Is Khan,Badiul Alam Khokon,"Shakib Khan, Apu Biswas, Prabir Mitra, Misha Sawdagor",2013,"Action, Romance"
83768173,Bhalobasha Aaj Kal,P.A Kajal,"Shakib Khan, Mahiya Mahi, Misha Sawdagor, Kabila, Ali Raz",2013,"Romance, Comedy"
83768174,Ek Paye Nupur,Babul Reza,"Aman, Anna, Amir Siraji, Gulshan Ara",2013,Romance
83768175,Er Beshi Bhalobasha Jay Na,Jakir Hossain Raju,"Symon Sadik, Nijhum, Sohel Khan",2013,Romance
83768176,Kumari Maa,Shahdat Hossain Liton,"Nirab Hossain, Tuli, Asif Iqbal, Munmun",2013,"Romance, Drama"
83768177,Notun Shat Bhai Champa,Mizanur Rahman,"Sheikh Mizan, Karishma",2013,Drama
83768178,Eve Teasing,Kazi Hayat,"Kazi Maruf, Toma Mirza, Kazi Hayat",2013,"Action, Drama"
83768179,Mrittika Maya,Gazi Rakayet,"Raisul Islam Asad, Pijush Bandhapaddhay, Mamunur Rashid,",2013,Drama
83768180,Dhaka to Bombay,Uttam Akash,"Shakib Khan, Sahara, Omar Sani, Suchorita",2013,"Action, Drama"
83768181,Rupgawal,Habibur Rahman Habib,"Masum Aziz, Niloy Alamgir, Shimla, Champa",2013,"Drama, Romance"
83768182,Mon Tor Jonno Pagol,Hanif Reza Milon,"Kayes Arju, Sanjana, Habib Khan",2013,Romance
83768183,Kisu Asha Kisu Bhalobasha,Mostafizur Rahman Manik,"Ferdous Ahmed, Moushumi, Shabnur, Happy",2013,Romance
83768184,Banglar Paglu,Kishor Saha,"Abhi, Priyanka, Kabila, Aritra",2013,"Action, Romance"
83768185,Tobuo Bhalobashi,Montazur Rahman Akbar,"Bappy Chowdhury, Mahiya Mahi, Sohel Rana, Amit Hasan, Parveen Sultana Diti",2013,Romance
83768186,Udhao - Runaway,Amit Ashraf,"Monir Ahmed,Nawshaba Ahmed, Shahed Ali, Animesh Aich",2013,"Crime, Drama"
83768187,Purno Doirgho Prem Kahini,Shafi Uddin Shafi,"Shakib Khan, Joya Ahsan, Arifin Shuvoo",2013,Romance
83768188,Full and Final,Malek Afsari,"Shakib Khan, Bobby, Amit Hasan",2013,Action
83768189,Premik Number One,Rokibul Islam Rokib,"Shakib Khan, Apu Biswas, Nipun Akter, Dilip Chakrabarty, Bobita, Milon",2013,Romance
83768190,Ki Prem Dekhaila,Shah Muhammad Songhram,"Bappy Chowdhury, Achol, Ali Raz, Bobita",2013,Romance
83768191,Anishchit Jatra,Belal Ahmed,"Abul Kalam Azad, Momena Chowdhury, Dilip Chakrabarty, Anisur Rahman Milon",2013,Drama
83768192,Akoi Britte,Kazi Morshed,"Najnin Chumki, Tauquir Ahmed, Khalil, Raisul Islam Asad, Dolly Jahur",2013,Drama
83768193,Ayna Kahini,Razzak,"Somrat, Keya, Sohel Khan, Razzak",2013,"Romance, Drama"
83768194,Valobasha Zindabad,Debashish Biswas,"Arifin Shuvoo, Airin Sultana, Sadek Bacchu",2013,Romance
83768195,Inchi Inchi Prem,Raju Chowdhury,"Bappy Chowdhury, Bobby, Sohel Khan",2013,"Action, Drama"
83768196,Tomar Achi Tomari Thakbo,Kalam Kaisar,"Shrabon Khan, Nirjana, Moumita, Prabir Mitra, Khaleda Akter Kolpona",2013,Romance
83768197,Padma Parer Parboti,Rafiq Sikder,"Nipun Akter, Mamnun Hasan Emon, Nirab Hossain, Jayanta Chattopadhyay",2013,Romance
83768198,71 er Guerrilla,Mizanur Rahman Shamim,"Sohel Rana, Khaleda Akter Kolpona, Alexandar Bo",2013,Drama
83768145,Dabang,Azad Khan,"Zayed Khan, Bindia, Amit Hasan",2014,"Action, Romance"
83768146,Daag Ei Buker Bhetor,Bazlur Rashed Chowdhury,"Jibon Islam, Pina",2014,"Action, Romance"
83768147,Ki Darun Dekhte,Wazed Ali Sumon,"Mahiya Mahi, Bappy Chowdhury, Shah Riaz, Misha Sawdagor",2014,"Action, Romance"
83768148,Moner Moddhe Lekha,Mahmud Hossain Murad,"Sagor, Shompa, Amit Hasan",2014,Romance
83768149,Tomar Kache Rhini,Shahdat Hossain Liton,"Symon Sadik, Toma Mirza, Bobita",2014,"Romance, Drama"
83768150,Agnee,Iftakar Chowdhury,"Mahiya Mahi, Arifin Shuvoo, Misha Sawdagor, Ali Raj",2014,Action
83768151,Akash Koto Dure,Samia Zaman,"Ongkon, Faria, Razzak, Misha Sawdagor",2014,Romance
83768152,"Lobhe Paap, Paape Mrittu",Shohanur Rahman Shohan,"Riaz, Purnima, Amin Khan, Nasrin, Sadeq Bacchu",2014,"Romance, Drama"
83768153,Jibon Dhuli - The Drummer,Tanvir Mokammel,"Shatabdi Wadud, Ramendu Majumdar, Wahida Mollick Jolly",2014,"Drama, War"
83768154,Prem Ki Oporadh,Jadu Azad,"Hridoy Chowdhury, Priyanka, Ahmed Sharif",2014,Romance
83768155,Kushumpurer Golpo,Ferdous Wahid,"Palash, Moumita, Jasmine",2014,Drama
83768156,Are You Listening!,Kamar Ahmad Simon,,2014,documentary film
83768157,Shima Rekha,Deowan Nazmul,"Fahim, Faria, Bobita, Rajatava Datta",2014,Romance
83768158,Rajotto,Iftakar Chowdhury,"Bobby, Shakib Khan",2014,"Action, Romance"
83768159,Anantakaler - Forever,Masum Aziz,"Aysharjyo Birjan, Shuchitra",2014,Romance
83768160,1 No. Ashami,Raju Chowdhury,"Masum Parvez Rubel, Poly",2014,Action
83768161,Toke Valobashtei Hobe,Raju Chowdhury,"Zayed Khan, Shahara, Rina Khan",2014,"Action, Romance"
83768162,Boishommo - Journey of the heart,Adam Doula,"Abir Hossain Ongkon, Adam Doula, Mita Chowdhury",2014,Thriller
83768163,71 er Shongram,Munsur Ali,"Anupam Kher, Asia Argento, Amaan Reza,  Dilruba Yasmeen Ruhee",2014,"Romance, War"
83768164,Dobir Saheber Songsar ,Jakir Hossain Raju,"Ali Raz, Mahiya Mahi, Bappy Chowdhury",2014,Comedy
83768165,Anukrosh,Golam Mostafa Shimul,"Pijush Bandyopadhyay, Keramat Mawla, Raisul Islam Ashad, Riaz Mahmud Jewel",2014,"Drama, War"
83768166,Daring Lover,Badiul Alam Khokon,"Shakib Khan, Apu Biswas, Misha Sawdagor",2014,"Action, Romance"
83768167,Jonakir Alo,Khalid Mahmud Mithu,"Mamnun Hasan Emon, Bidya Sinha Mim",2014,Romance
83768168,Maa er Momota,Mostafizur Rahman Babu,"Mamnun Hasan Emon, Nipun Akter, Suchorita",2014,"Romance, Drama"
83768169,Jaan,G Sarker,"Mamnun Hasan Emon, Bindia, Amaan, Anna",2014,Romance
83768170,Bhalobasha Express,Shafi Uddin Shafi,"Shakib Khan, Apu Biswas, Mim Chowdhury",2014,Romance
83768171,Ami Shudhu Cheyechi Tomay ,"Ashok Pati, Anonno Mamun","Ankush Hazra, Subhashree Ganguly, Misha Sawdagor",2014,"Action, Romance"
83768172,Kacher Shatru,M A Auwal,"Amin Khan, Nipun Akter, Shomrat",2014,Action
83768173,Duti Moner Paglami,Julhash Chowdhury Polash,"Nupur, Romeo",2014,Romance
83768174,Fand - The Trap,Shafi Uddin Shafi,"Shakib Khan, Achol, Amit Hasan, Kazi Hayat",2014,"Action, Romance"
83768175,Taarkata,Muhammad Mostafa Kamal Raz,"Arifin Shuvoo, Bidya Sinha Mim, Moushumi",2014,"Crime, Thriller"
83768176,Nekabborer Mahaprayan,Masud Pathik,"Mamunur Rashid, Prabir Mitra, Shimla, Nirmalendu Goon",2014,Drama
83768177,Honeymoon,Shafi Uddin Shafi,"Bappy Chowdhury, Mahiya Mahi",2014,Romance
83768178,Most Welcome 2,Ananta Jalil,"Ananta Jalil, Afiea Nusrat Barsha, Shohel Rana",2014,"Action, Romance"
83768179,Mukti,P A Kajal,"Shoccho, Parveen Sultana Diti, Shohel Rana",2014,Drama
83768180,Headmaster,Delwar Jahan Jhontu,"Alamgir, Suborna Mustafa, Kayes Arju",2014,Drama
83768181,Priya Tumi Shukhi Hou,Geetali Hasan,"Shaila Shabi, Shohel Rana, Ferdous",2014,Romance
83768182,I Don't Care,Mohammad Hossain,"Bobby, Bappy Chowdhury",2014,"Action, Romance"
83768183,Hero: The Superstar,Badiul Alam Khokon,"Shakib Khan, Apu Biswas, Bobby, Bobita, Notun",2014,"Action, Romance"
83768184,Bhalobashar Tajmahal,Ahsanullah Moni,"Akash, Hena",2014,Romance
83768185,Adrishyo Shotru,Eiyul Raiyan,"Eiyul Raiyan, Shohel Rana, Priya Aman",2014,Action
83768186,Olpo Olpo Premer Golpo,Saniat S Hossain,"Niloy Alamgir, Anika Kabir Shokh",2014,"Romance, Action"
83768187,Age Jodi Jantam Tui Hobi Por,Montazur Rahman Akbar,"Abhi, Ariyan Shah, Pushpita, Prabir Mitra",2014,Romance
83768188,Love Station,Shahdat Hossain Liton,"Bappy Chowdhury, Mishti Jannat,Kazi Hayat, Shahnoor",2014,"Romance, Action"
83768189,Tui Shudhu Amar,Raju Chowdhury,"Symon Sadik, Moumita",2014,"Action, Romance"
83768190,Bhalobashle Dosh Ki Tate,Khokon Rizbhi,"Nir, Arav Khan, Joy Chowdhury",2014,Romance
83768191,Sedin Brishti Chilo,Shaheen Sumon,"Ratna, Sumit (debut)",2014,Horror
83768192,Brihonnola,Murad Parvez,"Ferdous Ahmed, Sohana Saba",2014,Drama
83768193,Amra Korbo Joy,Ahsan Sorwar,"Ahsan Sadaf, Konica",2014,Horror
83768194,Kistimaat,Ashiqur Rahman,"Arifin Shuvoo, Achol, Misha Sawdagor",2014,"Action, Romance"
83768195,Kothin Protishodh,Nazrul Islam Khan,"Shakib Khan, Apu Biswas, Misha Sawdagor",2014,"Action, Romance"
83768196,Hitman,Wazed Ali Sumon,"Shakib Khan, Apu Biswas, Sujata, Misha Sawdagor",2014,Action
83768197,Shera Nayok,Wakil Ahmed,"Shakib Khan, Apu Biswas, Misha Sawdagor, Ali Raz",2014,"Romance, Action"
83768198,Time Machine,Symon Jahan,"Ratna, Sourav Sidak, Irene, Modhumoni, Yamin",2014,Fantasy
83768199,Ant Story,Mostofa Sarwar Farooki,"Sheena Chohan, Nur Imran Mithu",2014,"Comedy, Drama"
83768200,Jane Na E Mon,M A Rahim,"Mamnun Hasan Emon, Jaanvi",2014,"Romance, Action"
83768201,My Name is Simi,Montazur Rahman Akbar,"Simi Akter Koli, Zayed Khan, Misha Sawdagor",2014,Action
83768202,Horijon,Mirza Shakhwat Hossain,"Rokeya Prachi, Jayanta Chattopadhyay, Mamunur Rashid, Arjumand Ara Bokul",2014,Drama
83768203,Onek Sadher Moyna,Jakir Hossain Raju,"Mahiya Mahi, Bappy Chowdhury, Anisur Rahman Milon",2014,"Romance, Drama"
83768204,Onek Shadhonar Pore,Abul Kalam Azad,"Nijhum Rubina, Shanto, Prabir Mitra",2014,"Romance, Action"
83768205,Shopno Je Tui,Monirul Islam Shohel,"Mamnun Hasan Emon, Achol, Kazi Hayat",2014,Romance
83768206,Shorbonasha Ya ba,Kazi Hayat,"Kazi Maruf, Prosun Azad, Kazi Hayat",2014,"Action, Drama"
83768207,Char Okkhore Bhalobasha,Jakir Khan,"Ferdous Ahmed, Popy, Nirab Hossain",2014,Romance
83768208,Ek Cup Cha,Naeem Imtiaz Neamul,"Mousumi, Ferdous, Rituparna Sengupta, Alamgir,Humayun Faridi, Abdur Razzak",2014,Romance
83768209,Prem Korbo Tomar Sathe,Raqibul Alam,"Zayed Khan, Zakia Bari Momo, Anisur Rahman Milon",2014,Romance
83768210,Meghmallar,Zahidur Rahim Anjan,"Shahiduzzaman Selim, Aparna Ghose, Jayanto Chattopadhyay",2014,"Drama, War"
83768211,Shopno Chhoya,Shafiq Hasan,"Symon Sadik, Bobby",2014,Romance
83768212,Ekattorer Khudiram,Mannan Hira,"Mamunur Rashid, Fazlur Rahman Babu, Momena Chowdhury",2014,Drama
83768213,Zero Theke Top Hero,Shaheen Sumon,"Jeff, Itisha, Sumit",2014,Action
83768214,Ekattorer Maa Jononi,Shah Alam Kiran,"Nipun Akter, Agun, Gulshan Ara",2014,"War, Drama"
83768215,Khoniker Bhalobasha,Abul Kashem Mondol,"Shireen Shila, Joy Chowdhury",2014,Romance
83768216,Desha: The Leader,Saikat Nasir,"Shipan Mitra, Mahiya Mahi, Tariq Anam Khan",2014,"Political, Thriller"
83768145,Game,Royal Anik,"Nirab Hossain, Amrita Khan",2015,Action
83768146,Chupi Chupi Prem,Mostafizur Rahman Manik,"Symon Sadik, Priyonti, Misha sawdagor, Ali Raj",2015,Comedy
83768147,Putro Ekhon Poysawala,Nargis Akter,"Bobita, Omar Ayaz Oni, Farah Ruma, Mamnun Hasan Emon, Shaina Amin",2015,Drama
83768148,Romeo vs Juliet,Abdul Aziz,"Mahiya Mahi, Ankush Hazra",2015,Romantic comedy
83768149,Zero Degree,Animesh Aich,"Mahfuz Ahmed, Joya Ahsan, Dilruba Yasmeen Ruhee",2015,Psychological thriller
83768150,Big Brother,Shafi Uddin Shafi,"Mahiya Mahi, Shipan Mitra, Ahmed Sharif, Danny Sidak, Arjumand Ara Bokul",2015,"Action, Comedy"
83768151,Bhalobasha Simaheen,Shah Alam Mukul,"Pori Moni, Anisur Rahman Milon, Zayed Khan",2015,Romantic
83768152,Kartooz,Bapparaj,"Farzana Rikta, Samraat, Nipun",2015,"Action, Crime, Thriller"
83768153,This Is Love: Eito Prem,Shohel Arman,"Shakib Khan, Afsana Ara Bindu",2015,"Romance, Drama, War"
83768154,Chuye Dile Mon,Shihab Shaheen,"Arifin Shuvoo, Zakia Bari Momo",2015,Romance
83768155,Gunda: The Terrorist,,"Bappy Chowdhury, Achol, Amrita Khan",2015,Action
83768156,Warning,Shafi Uddin,"Arifin Shuvoo, Mahiya Mahi",2015,"Action, Thriller, Comedy"
83768157,Supatar Thikana,Prasun Rahman,"Aparna, Jayanta Chattapaddhay, Mahmudul Islam",2015,Drama
83768158,Action Jasmine,Iftakar Chowdhury,"Symon Sadik, Eamin Haque Bobby",2015,"Action, Comedy"
83768159,Ghashful,Akram Khan,"Kazi Asif, Shayla Sabi",2015,Drama
83768160,Ochena Hridoy: Unknown Love,Shafiqul Islam Khan,"Mamnun Hasan Emon, Prosun Azad, Abm Sumon",2015,Romance
83768161,Dui Prithibi,F I Manik,"Shakib Khan, Apu Biswas",2015,Romance
83768162,U-Turn,Alvee Ahmed,"Shipan Mitra, Irfaan Sajjad, Shahiduzzaman Selim, Misha Sawdagor",2015,Thriller
83768163,Padma Patar Jol,Tonmoy Tansen,"Mamnun Hasan Emon, Bidya Sinha Saha Mim",2015,Romance
83768164,Agnee II,Iftakar Chowdhury,"Mahiya Mahi, Om",2015,Action
83768165,Love Marriage,Shahin Sumon,"Shakib Khan, Apu Biswas",2015,"Action, Romance"
83768166,Black Money,Shafi Uddin,"Symon Sadik, Moushumi Hamid",2015,"Action, Comedy"
83768167,Aaro Bhalobashbo Tomay,S.A Alik,"Shakib Khan, Porimoni",2015,Romance
83768168,The Story of Samara,Rikia Masudo,Shiba Ali Khan,2015,"Horror, Supernatural"
83768169,Jalal's Story,Abu Shahed,"Mosharraf Karim, Tauquir Ahmed, Moushumi Hamid",2015,Drama
83768170,Aashiqui,"Abdul Aziz, Ashok Pati","Ankush Hazra, Nusraat Faria Mazhar",2015,Romance
83768171,Gariwala,Ashraf Shishir,,2015,"Family, Drama"
83768172,Runout,Tonmoy Tansen,"Shajal Noor, Mousumi Nag, Romana Shwarna",2015,"Action, Crime"
83768173,Gangster Returns,Ashiqur Rahman,"Ziaul Faruq Apurba, Jannatul Ferdous Peya",2015,Action
83768174,Antaranga,Chashi Nazrul Islam,"Alisha Pradhan, Mamnun Hasan Emon, Amit Hasan",2015,"Action, Romance"
83768175,Blackmail,Anonno Mamun,"Anisur Rahman Milon, Eamin Haque Bobby, Moushumi Hamid",2015,"Action, Romance, Thriller"
83768145,Matir Pori,Simon Tariq,"Symon Sadik, Moumita Mau, Sadia Islam Lamia",2016,"Romance, Action"
83768146,Raja 420,Uttam Akash,"Shakib Khan, Apu Biswas, Amit Hasan",2016,Comedy
83768147,Bhalobasboi To,Belal Ahmed,"Moushumi, Niloy Alamgir",2016,Romance
83768148,Sweetheart,Wajed Ali Sumon,"Riaz, Mim Bidya Sinha Saha, Bappy Chowdhury",2016,Romance
83768149,Bullet Babu,Moin Biswas,"Rohan, Emu Sikder, Shakira",2016,Action
83768150,Bhola To Jay Na Tare,Rafique Sikder,"Nirab Hossain, Tanha Tasnia",2016,Romance
83768151,Utola Mon,Abdul Awal,"Arian Shah, Nir, Monica",2016,Romance
83768152,Mon Jaane Na Moner Adhar,Mushfiqur Rahman Gulzar,"Moushumi, Ferdous",2016,Courtroom drama
83768153,Purno Doirgho Prem Kahini 2,Shafi Uddin Shafi,"Shakib Khan, Jaya Ahsan",2016,Sports
83768154,Shankhachil,Goutam Ghose,"Prosenjit Chatterjee, Kusum Sikder",2016,Drama
83768155,Musafir,Ashiqur Rahman,"Arifin Shuvoo, Marjan Jenifa",2016,"Action, Thriller"
83768156,Ostitto,Anonno Mamun,"Arifin Shuvoo, Tisha",2016,Romance
83768157,Aral,Shahed Chowdhury,"Shahriaz, Achol, Bipasha Kabir",2016,"Action, Thriller"
83768158,Mastani,Firoz Khan Prince,"Kazi Maruf, Moushumi Hamid",2016,"Action, Thriller"
83768159,Bossgiri,Shamim Ahamed Roni,"Shakib Khan, Shabnom Bubly",2016,"Romance, Thriller"
83768160,Rokto,Wajed Ali Sumon,"Ziaul Roshan, Pori Moni",2016,Action
83768161,Shooter,Raju Chowdhury,"Shakib Khan, Shabnom Bubly",2016,"Action, Romance"
83768162,Aynabaji,Amitabh Reza Chowdhury,"Chanchal Chowdhury, Nabila, Partha Barua",2016,Thriller
83768163,Prem Ki Bujhini,"Abdul Aziz, Sudipto Sarkar","Om, Subhashree Ganguly, Jannatul Ferdoush Peya",2016,"Romance, Thriller"
83768164,Ek Rasta,Iftakar Chowdhury,"Bappy Chowdhury, Anisur Rahman Milon, Bobby",2016,"Action, Thriller"
83768165,Lal Sobujer Sur,Mushfikur Rahman Guljar,"Omar Sani, Subrata, Shera Zaman, Rafiqullah Selim, Jhuna Chowdhury",2016,Historical drama
83768145,The God of Small Things,Saud Jubaer,"Mahmud Alam, Samin Sababa,",2017,Drama
83768146,Mastan O Police,Kazi Hayat,"Kazi Maruf, Bindiya",2017,Action
83768147,Rina Brown,Shameem Akhtar,"Saberi Alam, Tarik Anam",2017,"War, Drama"
83768148,Valobasha Emoni Hoy,Tania Ahmed,"Irfan Sazzad, Mim Bidya Sinha Saha",2017,Romance
83768149,Premi O Premi,Zakir Hossain Raju,"Arifin Shuvo, Nusrat Faria Mazhar",2017,Romance
83768150,Bhuban Majhi,Fakhrul Arefeen Khan,"Parambrata Chatterjee, Aparna Ghosh, Quazi Nawshaba Ahmed, Mamunur Rashid",2017,War
83768151,Meyeti Ekhon Kothay Jabe,Nader Chowdhury,"Falguni Rahman Jolly, Fazlur Rahman Babu, Shah Riaz",2017,Drama
83768152,Nuru Miah and His Beauty Driver,Mizanur Rahman,Fazlur Rahman Babu,2017,Drama
83768153,Sultana Bibiana,Himel Ashraf,"Bappy Chowdhury, Achol, Amit Hasan, Shahiduzzaman Selim, Mamunur Rashid",2017,Romance
83768154,Swatta,Hashibur Reza Kallol,"Shakib Khan, Paoli Dam",2017,"Romance, Drama"
83768155,Tui Amar,Sajol Ahmad,"Symon Sadik, Misty Jannat",2017,"Romance, Drama"
83768156,Dhat Teri Ki,Shamim Ahmed Roni,"Arifin Shuvo, Nusrat Faria Mazhar, Ziaul Roshan, Farin Khan",2017,Comedy
83768157,Apon Manush,Shah Alam Mondol,"Bappi Chowdhury, Pori Moni",2017,Romance
83768158,Porobashinee,Swapan Ahmed,"Mamnun Hasan Emon, Sabyasachi Chakrabarty, Reeth Mazumder",2017,Sci-Fi
83768159,Nabab,Joydeep Mukherjee,"Shakib Khan, Subhashree Ganguly, Amit Hasan, Rajatava Dutta",2017,Action
83768160,Rajneeti (2017 film),Bulbul Biswas,"Shakib Khan, Apu Biswas, Anisur Rahman Milon, Amit Hasan, Ali Raj",2017,Political thriller
83768161,Boss 2: Back to Rule,Baba Yadav,"Jeet, Nusrat Faria Mazhar",2017,Action
