Movie_ID,Title,Director,Cast,Year,Genre
83768162,Voyonkor Sundor,Animesh Aich,"Parambrata Chatterjee, Ashna Habib Bhabna",2017,Drama
83768163,Ohongkar,Shahadat Hossain,"Shakib Khan, Shabnam Bubly",2017,Romance
83768164,Drama,Jahangir Alam Sumon,"Popy (actress), DA Tayeb",2017,Drama
83768165,Rangbaaz,"Shamim Ahmed Roni, Abdul Mannan","Shakib Khan, Shabnom Bubly",2017,Action
83768166,Dhaka Attack,Deepankar Deepan,"Arifin Shuvo, Mahiya Mahi, Afzal Hossain, Shatabdi Wadud A B M Shumon, Nowshaba",2017,"Action, Thriller"
83768167,Dulavai Zindabad,Montazur Rahman Akbar,"Moushumi, Mim, Bappy, Dipjol",2017,"Action, Drama"
83768168,Doob: No Bed of Roses,Mostofa Sarwar Farooki,"Irrfan Khan, Nusrat Imrose Tisha",2017,Drama
83768169,Bengali Beauty,Rahsaan Noor,"Rahsaan Noor, Mumtaheena Toya",2017,"Romance, Historical Drama"
83768170,Noor Jahaan,Raj Chakraborty,"Puja Cherry, Adrit Roy",2017,Romance
83768171,Chalbaaz,Joydeep Mukherjee,"Shakib Khan, Subhashree Ganguly",2017,Thriller
83768172,Pashan,Saikat Nasir,"Mim Bidya Sinha Saha, Om Sahani",2017,Thriller
83768173,Detective,Tapan Ahmed,"Arifin Shuvo, Nusrat Faria Mazhar",2017,Animated
83768174,Inspector Notty K,Ashok Pati,"Jeet, Nusrat Faria Mazhar",2017,Comedy
83768175,Bhalo Theko,Zakir Hossain Raju,"Arifin Shuvo, Tanha Tasniya",2017,Romance
83768176,Bizli,Iftakar Chowdhury,Eamin Haque,2017,Superhero
83768177,Mrittupuri: Kill Zone,Zayed Rizwan,"Arifin Shuvo, Prosun Azad",2017,Action
83768178,Ami Neta Hobo,Uttam Akash,"Shakib Khan, Mim Bidya Sinha Saha",2017,Romance
83768145,I am Raaz,M Azad,"Raaz Ibrahim, Sabrina Mamia, Sadek Bachchu, Amir Siraji",2019,Action
83768146,Amar Prem Amar Priya,Shamimul Islam Shamim,"Kayes Arju, Pori Moni",2019,Romance
83768147,Daag Hridoye,Tarek Shikder,"Bappy Chowdhury, Bidya Sinha Saha Mim, Achol",2019,Romance
83768148,Fagun Haway,Tauquir Ahmed,"Nusrat Imrose Tisha, Siam Ahmed, Yashpal Sharma, Abul Hayat",2019,Historic
83768149,Ratrir Jatri,Habibul Islam Habib,"Moushumi, Anisur Rahman Milon",2019,Drama
83768150,Hrodoyer Rangdhanu,Rajibul Hossain,"Mina Petkovich, Muhtasin Sajal, Shams Kader",2019,Drama
83768151,Prem Amar 2,Bidula Bhattacharya,"Puja Cherry, Adrit Roy, Sourav Das, Champa, Nader Chowdhury",2019,Romance
83768152,Boyfriend,Uttam Akash,"Taskeen Rahman, Semanti Shoumi, Amit Hasan",2019,"Action, Romance"
83768153,Jodi Ekdin,Mohammad Mostafa Kamal Raz,"Tahsan, Srabanti, Taskeen Rahman, Afrin Shikha Raisa",2019,Romance
83768154,Bou Bazar,Mukul Netrabadi,"Shahriaz, Raaha Tanha Khan, Rehana Jolly",2019,"Romance, Comedy"
83768155,Karon Tomay Bhalobashi,Golam Mostafa Shimul,"Sabbir Ahmed, Bithi Rani Sarker, Najifa Chowdhury",2019,Romance
83768156,Live From Dhaka,Abdullah Mohammad Saad,"Mostafa Monowar, Tasnuva Tamanna",2019,Drama
83768157,Protishoder Agun,Mohammad Aslam,"Zayed Khan, Mou Khan, Shahriaz, Naaz, Danny Sidak",2019,"Action, Romance"
83768158,Alpha,Nasiruddin Yousuff,"ATM Shamsuzzaman, Alamgir Kabir, Doel",2019,Drama
83768159,Abar Boshonto,Ananya Mamun,"Tariq Anam Khan, Orchita Sporshia",2019,Drama
83768160,Aloy Vubon Bora,Amirul Islam,"Saif Khan, Mishti Maria, Aruna Biswas, Shahidul Alam Sachchu",2019,"Romance, Drama"
83768161,The Director,"Kamruzzaman KamuMosharraf Karim, Popy, Marzuk Russell",Drama,2019,Drama
83768162,Nolok,Sakib Sonet and his team,"Shakib Khan, Bobby, Tariq Anam Khan, Rajatava Dutta, Shahidul Alam Sachchu, Supriyo Dutta",2019,Romance
83768163,Password,Malek Afsary,"Shakib Khan, Shabnom Bubly, Emon, Misha Sawdagor",2019,"Crime, Action"
83768164,Bhalobashar Uttap,Shahidul Alam Sachchu,"Emon, Mishti Maria, Aruna Biswas, Abdullah Rana",2019,"Romance, Drama"
83768165,Anuprobesh,Taposh Kumar Datta,"Anwar Sayem, Danjida Islam, Pijush Bandyopadhyay",2019,Sci-Fi
83768166,Kalo Megher Vela,Mrittika Gun,"Arun, Runa Khan, Sumon Biswas",2019,Drama
83768167,Goendagiri,Nasim Sahnic,"Kalyan Corraya, Tania Bristy, Shampa Hasnain",2019,Detective
83768168,Akash Mohal,Delwar Jahan Jhantu,"Emon, Airin, Danny Sidak",2019,Fantasy
83768169,Bhalobashar Rajkonna,Raju Alim,"Moushumi Hamid, Shipan Mitra, Abid Rehan",2019,Romance
83768170,Bhalobashar Jala,Boshir Ahmed,"Shakil Khan, Arpa, Shabnam Parveen, Afzal Sharif",2019,Romance
83768171,Moner Moto Manush Pailam Naa,Zakir Hossain Raju,"Shakib Khan, Shabnom Bubly, Misha Sawdagar",2019,"Action, Romance"
83768172,Obotar,Mahmud Hasan Shikder,"Mahiya Mahi, JH Rusho, Amin Khan, Misha Sawdagor",2019,Action
83768173,Mayaboti,Arun Chowdhury,"Nusrat Imrose Tisha, Yash Rohan, Fazlur Rahman Babu",2019,Drama
83768174,Paglami,Komol Sarker,"Bappy Chowdhury, Shrabani Roy",2019,Romance
83768175,Shapludu,Golam Sohrab Dodul,"Arifin Shuvo, Mim, Zahid Hasan, Tariq Anam Khan, Shatabdi Wadud",2019,Thriller
83768176,Dongiri,Shah Alam Mondol,"Bappy Chowdhury, Amiya Amei, Anisur Rahman Milon, Misha Sawdagar",2019,"Action, Romance"
83768177,Padmar Prem,Harunuzzaman,"Airin Sultana, Sumit Sengupta, Sadek Bacchu, Jayanta Chattopadhyay",2019,Drama
83768178,Begum Jaan,Mohammad Aslam,"Emon, Shirin Shila, Aurin",2019,"Crime, Action"
83768179,"Sincerely, Your Dhaka","Abdullah Al Nur, Golam Kibria Farooki, Tanim Noor, Krishnendu Chattopadhyay, Mahmdul Islam, Robiul Alam, Mir Mukarram Hossain, Nuhash Humayun, Rahat Rahman, Syed Ahmed Shawki, Syed Saleh Ahmed Subhan and Tanvir Ahsan","Nusrat Imrose Tisha, Shatabdi Wadud, Intekhab Dinar, Iresh Zaker, Orchita Sporshia, Manoj Kumar Pramanik, Mostafa Monowar, Allen Shuvro, Shahtaj Monira Hashem, Rawnak Hasan",2019,Drama
83768180,No Dorai,Taneem Rahman Angshu,"Sariful Raaz, Sunerah Binte Kamal, Sayed Babu",2019,"Sports, Drama"
83768181,Indubala,Joy Sarkar,"Anisur Rahman Milon, Payel, Fazlur Rahman Babu",2019,Drama
83768182,Prem Chor,Uttam Akash,"Shanto Khan, Neha Amandeep",2019,Romance
83768183,Garments Sromik Zindabad,Mustafizur Rahman Babu,"Kazi Maruf, Aurin, Rubel, Amit Hasan",2019,Action
83768184,Farayezi Andolan 1842,Dayel Rahman,"Amin Khan, Nawsheen",2019,"History, Drama"
83768185,Gohiner Gaan,Sadat Hossain,"Asif Akbar, Toma Mirza, Tanzika Amin, Syed Hasan Imam",2019,Musical